{
  "contract_version": "video-export-request/3.0",
  "target": {"kind": "album"},
  "profile_id": "youtube-1080p30-motion-v2",
  "effects": {
    "pan_zoom": {"enabled": true, "max_zoom": 1.04, "path": "diagonal_down_right", "cycle_seconds": 180.0, "return_to_origin": true, "return_duration_seconds": 5.0, "easing": "smoothstep"},
    "audio_bars": {"enabled": true, "variation_mode": "organic_rms", "bar_count": 24, "color": "#FF69B4", "opacity": 0.65, "placement": "bottom_center", "zone_width_px": 640, "zone_height_px": 180, "gap_px": 4, "horizontal_offset_px": 0, "bottom_margin_px": 64, "rms_window_samples": 1920, "attack_ms": 60.0, "release_ms": 240.0, "glow": {"enabled": true, "intensity": 0.35}},
    "track_progress": {"enabled": true, "style": "line", "placement": "bottom", "color": "#FF69B4", "fill_opacity": 0.8, "rail_color": null, "rail_contrast_strength": 0.6, "rail_opacity": 0.35, "thickness_px": 6, "segment_count": 20}
  }
}
